{
  "contractVersion": "0.1.0",
  "id": "incident_ses_demo_math_001_001",
  "sessionId": "ses_demo_math_001",
  "learnerId": "learner_demo_anonymous",
  "policyId": "safety.minor.default",
  "severity": "medium",
  "category": "content_safety",
  "trigger": "unsafe_advice_request",
  "description": "Tutor output was blocked because it matched a configured unsafe-advice trigger.",
  "actionTaken": "blocked",
  "occurredAt": "2026-05-29T00:00:00.000Z",
  "relatedEventId": "evt_problem_presented_001",
  "tutorResponseId": null,
  "metadata": {
    "requiredActions": ["block_tutor_response", "human_review"]
  }
}
